<!ELEMENT students (CNE,LastName,FirstName,DateofBirth,Phone,Email)>
<!ELEMENT LastName (#PCDATA)>
<!ELEMENT CNE (#PCDATA)>
<!ELEMENT FirstName (#PCDATA)>
<!ELEMENT DateofBirth (#PCDATA)>
<!ELEMENT Phone (#PCDATA)>
<!ELEMENT Email (#PCDATA)>